03:14:44.024952 IP6 fe80::8046:fcff:fe2c:5aad > ff02::16: HBH ICMP6, multicast listener report v2, 1 group record(s), length 28
03:14:44.961056 IP6 fe80::8046:fcff:fe2c:5aad > ff02::16: HBH ICMP6, multicast listener report v2, 1 group record(s), length 28
03:14:54.015763 IP6 fe80::8046:fcff:fe2c:5aad > ff02::5: OSPFv3, Hello, length 36
03:15:04.015776 IP6 fe80::8046:fcff:fe2c:5aad > ff02::5: OSPFv3, Hello, length 36
03:15:14.015753 IP6 fe80::8046:fcff:fe2c:5aad > ff02::5: OSPFv3, Hello, length 36
03:15:24.015869 IP6 fe80::8046:fcff:fe2c:5aad > ff02::5: OSPFv3, Hello, length 36
03:15:24.025021 IP6 fe80::8046:fcff:fe2c:5aad > ff02::16: HBH ICMP6, multicast listener report v2, 1 group record(s), length 28
03:15:24.353036 IP6 fe80::8046:fcff:fe2c:5aad > ff02::16: HBH ICMP6, multicast listener report v2, 1 group record(s), length 28
03:15:34.016074 IP6 fe80::8046:fcff:fe2c:5aad > ff02::5: OSPFv3, Hello, length 36
03:15:44.016081 IP6 fe80::8046:fcff:fe2c:5aad > ff02::5: OSPFv3, Hello, length 36
03:15:54.016115 IP6 fe80::8046:fcff:fe2c:5aad > ff02::5: OSPFv3, Hello, length 36
03:16:04.016121 IP6 fe80::8046:fcff:fe2c:5aad > ff02::5: OSPFv3, Hello, length 36
03:16:14.016156 IP6 fe80::8046:fcff:fe2c:5aad > ff02::5: OSPFv3, Hello, length 36
03:16:24.016168 IP6 fe80::8046:fcff:fe2c:5aad > ff02::5: OSPFv3, Hello, length 36
03:16:34.016215 IP6 fe80::8046:fcff:fe2c:5aad > ff02::5: OSPFv3, Hello, length 36
03:16:44.016218 IP6 fe80::8046:fcff:fe2c:5aad > ff02::5: OSPFv3, Hello, length 36
03:16:54.016223 IP6 fe80::8046:fcff:fe2c:5aad > ff02::5: OSPFv3, Hello, length 36
03:17:04.016714 IP6 fe80::8046:fcff:fe2c:5aad > ff02::5: OSPFv3, Hello, length 36
03:17:14.016687 IP6 fe80::8046:fcff:fe2c:5aad > ff02::5: OSPFv3, Hello, length 36
03:17:24.017023 IP6 fe80::8046:fcff:fe2c:5aad > ff02::5: OSPFv3, Hello, length 36

